Ticker,Company Name,Sector,AI Status,Watchlist Tier,Signal Status
ATLC.CA,Al Tawfeek Leasing,Non-bank Financial Services,Active Tracking,WATCH,BUY_READY
KWIN.CA,El Kahera El Watania Investment,General / Verified EGX Expansion,Active Tracking,WATCH,BUY_READY
MASR.CA,Madinet Masr For Housing and Development,General / Verified EGX Expansion,Active Tracking,WATCH,BUY_READY
HRHO.CA,EFG Holding,Non-bank Financial Services,Active Tracking,WATCH,BUY_READY
MTIE.CA,MM Group For Industry and International Trade,Automotive & Distribution,Active Tracking,WATCH,BUY_READY
