Ticker,Company Name,Sector,AI Status,Watchlist Tier,Signal Status
DOMT.CA,Arabian Food Industries Domty,"Food, Beverages & Tobacco",Active Tracking,WATCH,BUY_READY
CIEB.CA,Credit Agricole Egypt,Banking & Financials,Active Tracking,WATCH,BUY_READY
CNFN.CA,Contact Financial Holding,Non-bank Financial Services,Active Tracking,WATCH,BUY_READY
OCDI.CA,Sixth of October Development and Investment,Real Estate,Active Tracking,WATCH,BUY_READY
ADCI.CA,The Arab Drug Company,General / Verified EGX Expansion,Active Tracking,WATCH,BUY_READY
