Ticker,Company Name,Sector,AI Status,Watchlist Tier,Signal Status
DAPH.CA,Development & Engineering Consultants,General / Verified EGX Expansion,Active Tracking,WATCH,WATCH_ONLY
OCDI.CA,Sixth of October Development and Investment,Real Estate,Active Tracking,WATCH,WATCH_ONLY
CIRA.CA,Cairo Investment and Real Estate Development,Education,Active Tracking,WATCH,WATCH_ONLY
GIHD.CA,Gharbia Islamic Housing Development Company,General / Verified EGX Expansion,Active Tracking,WATCH,WATCH_ONLY
CLHO.CA,Cleopatra Hospital Group,Healthcare,Active Tracking,WATCH,WATCH_ONLY
